{
  "schemaVersion": 1,
  "project": "Esencial SEO/CMS",
  "repositoryPath": "C:\\Users\\lucas\\Documents\\Codex\\2026-08-21\\sta\\work\\Esencial",
  "baselineSha": "032bfeae23a2ec318d395bfc778d84cc542baa51",
  "integrationRef": "codex/orchestrator-bootstrap",
  "totalContexts": 5,
  "maxWorkers": 4,
  "updatedAt": "2026-08-22",
  "stages": [
    {
      "id": "S0",
      "title": "Baseline and architecture",
      "ownerLane": "Coordinator",
      "dependencies": [],
      "state": "DONE",
      "stateReason": "The verified Stage 1–7 checkpoint, architecture mapping, runbook, isolated bootstrap worktree, and deterministic registry complete the automation baseline.",
      "model": "GPT-5.6 Sol",
      "effort": "high",
      "ownedPaths": ["orchestration/**", "audit/orchestration/**"],
      "sharedHotspots": ["package.json", "ESENCIAL_PARALLEL_CODEX_RUNBOOK.md"],
      "acceptanceCommands": ["node orchestration/status.mjs", "node --test orchestration/status.test.mjs"],
      "reportPaths": ["audit/seo-final/01-repository-audit.md", "audit/orchestration/bootstrap-report.md"],
      "evidence": ["ESENCIAL_PARALLEL_CODEX_RUNBOOK.md", "orchestration/stages.schema.json"],
      "manualBlockers": ["Long-term external-account ownership remains a human governance decision before production."]
    },
    {
      "id": "S1",
      "title": "Live/repository visual and functional parity",
      "ownerLane": "Worker A",
      "dependencies": ["S0"],
      "state": "DONE",
      "stateReason": "40 route/viewport pairs and four interaction scenarios passed with zero measured geometry, style, structural, console, or interaction mismatches.",
      "model": "GPT-5.6 Terra",
      "effort": "medium",
      "ownedPaths": ["scripts/check-reference-parity.js", "scripts/compare-screenshots.js", "screenshots/**"],
      "sharedHotspots": ["public/index.html", "public/about/index.html", "public/om-oss/index.html", "public/projects/index.html", "public/wp-content/themes/esencial/css/styles.css"],
      "acceptanceCommands": ["corepack pnpm run check-reference-parity", "corepack pnpm run compare-screenshots", "corepack pnpm run check-functionality"],
      "reportPaths": ["audit/seo-final/03-reference-parity.md"],
      "evidence": ["audit/seo-final/stage-1-parity-evidence.json", "audit/visual-diff-report.json"],
      "manualBlockers": ["The live reference can drift after the dated capture; recapture before final release."]
    },
    {
      "id": "S2",
      "title": "Legacy and dead-code cleanup",
      "ownerLane": "Worker D",
      "dependencies": ["S0"],
      "state": "DONE",
      "stateReason": "Proven-dead WordPress, analytics, admin, and font artifacts were removed while used recovery paths and theme behavior were retained and parity-tested.",
      "model": "GPT-5.6 Sol",
      "effort": "high",
      "ownedPaths": ["scripts/clean-legacy-export.js", "public/wp-includes/**", "public/wp-content/plugins/**", "public/assets/original-paths/external/**"],
      "sharedHotspots": ["public/index.html", "public/about/index.html", "public/om-oss/index.html", "public/projects/index.html"],
      "acceptanceCommands": ["corepack pnpm run clean:legacy", "corepack pnpm run build", "corepack pnpm run check-reference-parity"],
      "reportPaths": ["audit/seo-final/04-code-hygiene.md"],
      "evidence": ["scripts/clean-legacy-export.js"],
      "manualBlockers": []
    },
    {
      "id": "S3",
      "title": "Technical SEO and indexability",
      "ownerLane": "Worker B",
      "dependencies": ["S0"],
      "state": "DONE",
      "stateReason": "All 56 indexable pages match the sitemap and canonical contract; repository status, host, trailing-slash, preview-noindex, and 404 behavior have deterministic checks.",
      "model": "GPT-5.6 Sol",
      "effort": "high",
      "ownedPaths": ["scripts/check-seo.js", "scripts/check-local-url-behavior.js"],
      "sharedHotspots": ["vercel.json", "public/robots.txt", "public/sitemap.xml", "package.json"],
      "acceptanceCommands": ["corepack pnpm run build", "corepack pnpm run audit:technical-seo", "corepack pnpm run check-links"],
      "reportPaths": ["audit/seo-final/05-technical-seo.md"],
      "evidence": ["audit/seo-final/stage-3-technical-evidence.json", "audit/seo-final/stage-3-http-evidence.json"],
      "manualBlockers": ["Verify headers, robots, sitemap, and redirect behavior again after an authorized production cutover."]
    },
    {
      "id": "S4",
      "title": "Metadata and international SEO",
      "ownerLane": "Worker B",
      "dependencies": ["S3"],
      "state": "DONE",
      "stateReason": "All 56 pages pass language, reciprocal hreflang, x-default, canonical, title, description, Open Graph, and Twitter consistency checks.",
      "model": "GPT-5.6 Sol",
      "effort": "high",
      "ownedPaths": ["scripts/check-international-seo.js"],
      "sharedHotspots": ["scripts/build-project-pages.js", "content/projects/**", "public/**", "package.json"],
      "acceptanceCommands": ["corepack pnpm run check-content", "corepack pnpm run check-international-seo", "corepack pnpm run build"],
      "reportPaths": ["audit/seo-final/09-international-seo.md"],
      "evidence": ["audit/seo-final/stage-4-international-evidence.json"],
      "manualBlockers": ["Nine legacy excerpts still require client-approved translation or replacement text."]
    },
    {
      "id": "S5",
      "title": "Semantic HTML and page structure",
      "ownerLane": "Worker A",
      "dependencies": ["S1", "S3"],
      "state": "DONE",
      "stateReason": "All 56 pages have validated H1 and landmark structure; the four reference pages retain measured visual and functional parity.",
      "model": "GPT-5.6 Terra",
      "effort": "high",
      "ownedPaths": ["scripts/check-semantic-html.js", "scripts/normalize-core-semantics.js"],
      "sharedHotspots": ["public/index.html", "public/about/index.html", "public/om-oss/index.html", "public/projects/index.html", "public/wp-content/themes/esencial/css/styles.css", "package.json"],
      "acceptanceCommands": ["corepack pnpm run check-semantics", "corepack pnpm run check-reference-parity", "corepack pnpm run build"],
      "reportPaths": ["audit/seo-final/06-content-semantic-seo.md"],
      "evidence": ["scripts/check-semantic-html.js", "audit/seo-final/stage-1-parity-evidence.json"],
      "manualBlockers": []
    },
    {
      "id": "S6",
      "title": "Project-page SEO architecture",
      "ownerLane": "Worker C",
      "dependencies": ["S0"],
      "state": "DONE",
      "stateReason": "All 52 bilingual project pages are source-validated and support approved facts, narrative, and editorial relationships without inventing missing content.",
      "model": "GPT-5.6 Sol",
      "effort": "xhigh",
      "ownedPaths": ["content/projects/**", "scripts/check-project-page-seo.js", "scripts/audit-project-content.js", "scripts/test-project-page-architecture.js"],
      "sharedHotspots": ["scripts/build-project-pages.js", "cms/studio/schemaTypes/projectType.ts", "scripts/fetch-sanity-content.js", "public/projekt/**", "public/projects/**", "package.json"],
      "acceptanceCommands": ["corepack pnpm run check-project-page-seo", "corepack pnpm run test-project-page-architecture", "corepack pnpm run audit:project-content", "corepack pnpm run check-content"],
      "reportPaths": ["audit/seo-final/07-project-seo.md"],
      "evidence": ["audit/seo-final/stage-6-project-content-evidence.json", "audit/seo-final/stage-6-project-content-gaps.md"],
      "manualBlockers": ["Project facts, publishable locations, translations, and editorial relationships require Esencial approval."]
    },
    {
      "id": "S7",
      "title": "Image SEO and responsive delivery",
      "ownerLane": "Worker C",
      "dependencies": ["S6"],
      "state": "DONE",
      "stateReason": "All 104 generated image uses pass alt, intrinsic-dimension, loading, responsive-photo, and drawing-preservation checks; 20 WebP derivatives are deterministic.",
      "model": "GPT-5.6 Sol",
      "effort": "high",
      "ownedPaths": ["content/image-variants.json", "scripts/build-image-variants.js", "scripts/check-image-seo.js", "public/assets/images/project/**"],
      "sharedHotspots": ["scripts/build-project-pages.js", "public/assets/css/project-pages.css", "public/projekt/**", "public/projects/**", "package.json"],
      "acceptanceCommands": ["corepack pnpm run build:image-variants", "corepack pnpm run check-image-seo", "corepack pnpm run build"],
      "reportPaths": ["audit/seo-final/08-image-seo.md"],
      "evidence": ["content/image-variants.json", "scripts/check-image-seo.js"],
      "manualBlockers": ["Credits, rights, captions, and filename migration require approved editorial and legal data."]
    },
    {
      "id": "S8",
      "title": "Structured data and entity graph",
      "ownerLane": "Worker B",
      "dependencies": ["S3", "S4", "S6"],
      "state": "DONE",
      "stateReason": "Integrated commit 55d07f3 validates one factual entity graph across all 56 indexable pages, including 52 CreativeWork entities and visible project breadcrumbs.",
      "model": "GPT-5.6 Sol",
      "effort": "xhigh",
      "ownedPaths": ["scripts/check-structured-data.js", "scripts/lib/schema/**", "audit/seo-final/10-structured-data-entity-seo.md"],
      "sharedHotspots": ["scripts/build-project-pages.js", "public/**", "package.json"],
      "acceptanceCommands": ["corepack pnpm run check-structured-data", "corepack pnpm run build"],
      "reportPaths": ["audit/seo-final/10-structured-data-entity-seo.md"],
      "evidence": ["scripts/check-structured-data.js", "scripts/lib/schema/entity-graph.js"],
      "manualBlockers": ["Unsupported organization or project facts must not be added without client confirmation."]
    },
    {
      "id": "S9",
      "title": "Performance and Core Web Vitals",
      "ownerLane": "Worker C",
      "dependencies": ["S1", "S7"],
      "state": "RUNNING",